代碼,學分,學時,老師,班級,Subject,科目,時間,地點
SC21,2,2,楊淑瓊,雙軌職四機一甲, Chinese（Ⅱ）,國文（二）,六08-09,國秀樓508教室
SC22,3,3,涂惠玲,雙軌職四機一甲, Freshman English（Ⅱ）,大一英文（二）,六04-04,"國秀樓2F語言教室C), 六06-0"
SC23,3,3,陳永銓,雙軌職四機一甲, Calculus（I）,微積分（一）,六01-03,國秀樓508教室
SC24,0,2,韋磊,雙軌職四機一甲, PhysicalEducation（Ⅱ）,體育（二）,六10-11,籃球場
SC25,2,3,陳永銓,雙軌職四機一甲, Practical Training（Ⅱ）,產業製造程序實習二,二07-09,
SC26,3,3,陳聰嘉,雙軌職四機一甲, The Program of Computer,程式語言,五05-07,機械館電腦輔助產品設計電腦教室
SC27,3,3,潘吉祥,雙軌職四機一甲, Machinery,機構學,五02-04,機械館電腦輔助產品設計電腦教室
SC28,3,3,陳聰嘉,雙軌職四機一甲, Dynamics,動力學,五08-10,機械館電腦輔助產品設計電腦教室
SC29,2,2,朱君苑,雙軌職四機三甲, Music Appreciation,音樂鑑賞,六02-03,國秀樓3F音樂欣賞教室
SC30,2,3,陳聰嘉,雙軌職四機三甲, The Internship of Industrial Materials Processing（II）,產業材料製程實習二,三01-03,
SC31,2,3,詹俊奕,雙軌職四機三甲, Computer-Aided Engineering Analysis,電腦輔助工程分析,六05-07,機械館CAE電腦教室
SC32,3,3,黃智勇,雙軌職四機三甲, The theory and Practice of Mechatronics,機電整合,五05-07,機械館機電整合實驗室
SC33,2,2,謝瑞青,雙軌職四機四甲, Work place ethics and career plan,職場倫理與生涯規劃,六02-03,國秀樓507教室
SC34,2,3,黃智勇,雙軌職四機四甲, Project study（Ⅱ）,專題製作（二）,一01-03,
SC35,3,3,林金雄,雙軌職四機四甲, Quality Control,品質管制,五02-04,機械館材料實驗室
SC36,0,0,,雙軌職四機一甲,,班週會時間,五11-12,國秀樓503教室
SC37,0,0,,雙軌職四機三甲,,班週會時間,六11-11,"機械館電腦輔助產品設計電腦教室), 六01-0"
SC38,0,0,,雙軌職四機四甲,,班週會時間,五01-01,"國秀樓407教室), 六01-0"
SD01,3,3,翁俊桔,雙軌職四訊二甲選1, Career Planning and Development,生涯規劃,五11-13,國秀樓003教室
SD02,3,3,蕭世雄,雙軌職四訊二三甲選, Laber Standards Act and its Enforcement Rule,勞動法規,六07-09,E529-工程館5F
SD03,3,3,林宗宏,雙軌職四訊三四甲選1, Fundamental Automata Theory,自動機原理概論,五05-07,E531-工程館5F
SD04,3,3,高長翰,雙軌職四訊三四甲選2, Case Study of Information System,資訊系統個案研究,五11-13,國秀樓506教室
SD05,3,3,黃宣詔,雙軌職四訊三四甲選3, Advanced Embedded System Design and Lab.,進階嵌入式系統設計及實習,六10-12,E547-工程館5F
SD06,3,3,黃國賢,雙軌職四訊四甲選, Application and Design of Computer Software,電腦軟體應用與設計,六07-09,國秀樓003教室
SD21,2,2,洪英雪,雙軌職四訊一甲, Chinese（Ⅱ）,國文（二）,一06-07,國秀樓305教室
SD22,2,2,郭宇婕,雙軌職四訊一甲, English for Science and Technology（Ⅱ）,科技英文（二 ）,六08-09,E445-工程館4F
SD23,0,2,梁隨燕,雙軌職四訊一甲, PhysicalEducation（Ⅱ）,體育（ 二 ）,一08-09,羽球場
SD24,2,2,陳瑞茂,雙軌職四訊一甲, Calculus（Ⅱ）,微積分（ 一 ）,六10-11,E529-工程館5F
SD25,2,3,林宗宏,雙軌職四訊一甲, Computer programming and experiment （Ⅱ）,程式設計與實習（二）,六03-05,E445-工程館4F
SD26,3,6,產業實務實習二,雙軌職四訊一甲, The Industry Practises Really and Practically（Ⅱ）,產業實務實習（二）,二01-06,
SD27,2,3,游正義,雙軌職四訊一甲, Digital Logic Laboratory,數位邏輯與實習,一02-04,E445-工程館4F
SD28,3,3,郭秋田,雙軌職四訊一甲, Basic Electricity,基本電學,一11-13,E445-工程館4F
SD29,0,2,高文揚,雙軌職四訊二甲, PhysicalEducation（Ⅳ）,體育（ 四 ）,六11-12,高爾夫球練習場
SD30,1,1,朱君苑,雙軌職四訊二甲, Music Appreciation,音樂鑑賞,六05-05,國秀樓3F音樂欣賞教室
SD31,3,3,林正堅,雙軌職四訊二甲, Linear Algebra,線性代數,五02-04,E445-工程館4F
SD32,3,3,林基源,雙軌職四訊二甲, Discrete Mathematics,離散數學,五05-07,E529-工程館5F
SD33,3,6,產業實務實習四,雙軌職四訊二甲, The Industry Practises Really and Practically（Ⅳ）,產業實務實習（四）,二04-06,"), 四05-0"
SD34,3,3,欉振坤,雙軌職四訊二甲, Computer Organization and Architecture,計算機組織與結構,六02-04,國秀樓003教室
SD35,2,2,邱惠玲,雙軌職四訊三甲, Japanese language for Technology（II）,科技日文 （二 ）,六03-04,國秀樓511教室
SD36,3,6,產業實務實習六,雙軌職四訊三甲, The Industry Practises Really and Practically（VI）,產業實務實習（六）,一02-04,"), 三02-0"
SD37,3,3,林學儀,雙軌職四訊三甲, Operating System,作業系統,五02-04,E531-工程館5F
SD38,3,6,產業實務實習八,雙軌職四訊四甲, The industry practises really and practically（VIII）,產業實務實習（八）,三02-07,
SD39,0,0,,雙軌職四訊一甲,,班週會時間,一05-05,E547-工程館5F
SD40,0,0,,雙軌職四訊二甲,,班週會時間,六01-01,E445-工程館4F
SD41,0,0,,雙軌職四訊三甲,,班週會時間,五01-01,E531-工程館5F
SD42,0,0,,雙軌職四訊四甲,,班週會時間,五01-01,E420-工程館4F
SE01,3,3,邱維銘,紡纖職二甲選, Introduction of Nanotechnology,奈米科技導論,二05-08,工程館E417電化教室三
SE02,3,3,張惠玲,紡纖職二乙選, Introduction of Nanotechnology,奈米科技導論,二01-04,工程館E417電化教室三
SE03,3,3,高肇郎,紡纖職三甲選1, Treatment of Solid Waste,固體廢棄物處理,一01-04,工程館E522電化教室一
SE04,3,3,戴永銘,紡纖職三甲選2, Introduction to green energy materials,綠色能源材料概論,一05-08,工程館E417電化教室二
SE05,3,3,張漢昌,紡纖職三乙選1, Treatment of Solid Waste,固體廢棄物處理,四05-08,工程館E417電化教室二
SE06,3,3,楊鎮遠,紡纖職三乙選2, Introduction to green energy materials,綠色能源材料概論,一05-08,工程館E417電化教室二
SE07,3,3,楊順通,紡纖職四甲選1, Production Management,生產管理,二10-13,國秀樓511教室
SE08,3,3,陳岡宏,紡纖職四甲選2, Application of Functional Textiles,機能性紡織品應用,三10-13,國秀樓409教室
SE09,3,3,楊順通,紡纖職四乙選1, Production Management,生產管理,二10-13,國秀樓511教室
SE10,3,3,陳岡宏,紡纖職四乙選2, Application of Functional Textiles,機能性紡織品應用,三10-13,國秀樓506教室
SE21,3,3,施盈佑,紡纖職一甲, Applied Chinese （Ⅱ）,應用國文（二）,四01-04,國秀樓401教室
SE22,3,3,林玉霞,紡纖職一甲, Practical English （Ⅱ）,實用英文（二）,二05-08,國秀樓010教室
SE23,3,3,洪國智,紡纖職一甲, Applied mathematics （Ⅱ）,應用數學（二）,三05-08,國秀樓303教室
SE24,0,2,陳小平,紡纖職一甲, PhysicalEducation（Ⅱ）,體育（二）,四05-07,合氣道教室
SE25,2,6,職場實習二,紡纖職一甲, Professional Course （Ⅱ）,職場實習（二）,六01-09,
SE26,3,3,倪聖中,紡纖職一甲, Common Chemistry,普通化學,二01-04,工程館E417電化教室三
SE27,3,3,黃世梁,紡纖職一甲, Introduction to Materials Science and Engineering,材料科學與工程概論,一05-08,工程館E417電化教室二
SE28,3,3,徐華中,紡纖職一乙, Applied Chinese （Ⅱ）,應用國文（二）,四01-04,國秀樓401教室
SE29,3,3,林玉霞,紡纖職一乙, Practical English （Ⅱ）,實用英文（二）,二05-08,國秀樓010教室
SE30,3,3,洪國智,紡纖職一乙, Applied mathematics （Ⅱ）,應用數學（二）,三05-08,國秀樓303教室
SE31,0,2,蔡輝炯,紡纖職一乙, PhysicalEducation（Ⅱ）,體育（二）,四05-07,高爾夫球練習場
SE32,2,6,職場實習二,紡纖職一乙, Professional Course （Ⅱ）,職場實習（二）,六01-09,
SE33,3,3,蔡美慧,紡纖職一乙, Common Chemistry,普通化學,五01-04,工程館E417電化教室三
SE34,3,3,歐珍方,紡纖職一乙, Introduction to Materials Science and Engineering,材料科學與工程概論,二03-04,"工程館E522電化教室一), 三03-0"
SE35,2,2,李俐潔,紡纖職二甲, Art Appreciation,藝術鑑賞,一02-04,國秀樓4F美術鑑賞教室
SE36,2,6,職場實習四,紡纖職二甲, Professional Course （Ⅳ）,職場實習（四）,六01-09,
SE37,3,3,謝淑枝,紡纖職二甲, Physical Chemistry （Ⅱ）,物理化學（二）,三05-08,工程館E016電化教室五
SE38,3,3,陳秋菊,紡纖職二甲, Organic Chemistry （Ⅱ）,有機化學（二）,五01-04,工程館E016電化教室五
SE39,3,3,劉仁湧,紡纖職二甲, Fibre chemistry,纖維化學,三10-13,國秀樓511教室
SE40,2,2,倪玉珊,紡纖職二乙, Art Appreciation,藝術鑑賞,一07-09,國秀樓4F美術鑑賞教室
SE41,2,6,職場實習四,紡纖職二乙, Professional Course （Ⅳ）,職場實習（四）,六01-09,
SE42,3,3,呂春美,紡纖職二乙, Physical Chemistry （Ⅱ）,物理化學（二）,三05-08,工程館E417電化教室三
SE43,3,3,蔡明瞭,紡纖職二乙, Organic Chemistry （Ⅱ）,有機化學（二）,二07-08,"工程館E417電化教室三), 三03-0"
SE44,3,3,劉仁湧,紡纖職二乙, Fibre chemistry,纖維化學,三10-13,國秀樓511教室
SE45,2,6,職場實習六,紡纖職三甲, Professional Course ﹙Ⅵ﹚,職場實習（六）,五10-14,"), 六10-1"
SE46,3,3,陳為照,紡纖職三甲, Weaving Technology,織造工程學,六01-04,國秀樓411教室
SE47,3,3,呂旭東,紡纖職三甲, Materials Chemistry,材料化學,三01-04,工程館E417電化教室三
SE48,3,3,呂春美,紡纖職三甲, Instrumental Analysis,儀器分析,四05-08,工程館E417電化教室三
SE49,2,6,職場實習六,紡纖職三乙, Professional Course ﹙Ⅵ﹚,職場實習（六）,五10-14,"), 六10-1"
SE50,3,3,陳為照,紡纖職三乙, Weaving Technology,織造工程學,六01-04,國秀樓411教室
SE51,3,3,黃怡銘,紡纖職三乙, Materials Chemistry,材料化學,一03-04,"工程館E417電化教室二), 三03-0"
SE52,3,3,陳秋菊,紡纖職三乙, Instrumental Analysis,儀器分析,五01-04,工程館E016電化教室五
SE53,2,6,職場實習八,紡纖職四甲, Professional Course（Ⅷ）,職場實習（八）,五10-14,"), 六10-1"
SE54,3,3,邱素伶,紡纖職四甲, Marketing Management-Textile Industry,紡織業行銷與管理,一05-08,國秀樓402教室
SE55,2,2,黃怡銘,紡纖職四甲, Seminar,書報討論,一02-04,工程館E417電化教室三
SE56,2,6,職場實習八,紡纖職四乙, Professional Course（Ⅷ）,職場實習（八）,五10-14,"), 六10-1"
SE57,3,3,邱素伶,紡纖職四乙, Marketing Management-Textile Industry,紡織業行銷與管理,一05-08,國秀樓402教室
SE58,2,2,呂旭東,紡纖職四乙, Seminar,書報討論,三05-07,工程館E417電化教室二
SE59,0,0,,紡纖職一甲,,班週會時間,一09-10,工程館E417電化教室二
SE60,0,0,,紡纖職一乙,,班週會時間,三01-02,工程館E522電化教室一
SE61,0,0,,紡纖職二甲,,班週會時間,五05-06,工程館E417電化教室二
SE62,0,0,,紡纖職二乙,,班週會時間,三01-02,工程館E417電化教室三
SE63,0,0,,紡纖職三甲,,班週會時間,一09-10,工程館E522電化教室一
SE64,0,0,,紡纖職三乙,,班週會時間,三01-02,工程館E417電化教室二
SE65,0,0,,紡纖職四甲,,班週會時間,一09-10,工程館E417電化教室三
SE66,0,0,,紡纖職四乙,,班週會時間,三08-09,工程館E417電化教室二
SF01,3,3,許智能,綠能職大三, Clean room technology,無塵室技術,一05-07,E018冷凍空調自動控制實驗室
SF02,3,3,李哲尹,綠能職大三, Indoor Air Quality,室內空氣品質,二02-04,E109能源工程實驗室
SF03,3,3,楊育荃,綠能職大三, Fire Trotection Engineering,消防工程概論,四05-07,國秀樓506教室
SF04,3,3,楊愷祥,綠能職大三, Cryogenic Engineering,低溫工程,五05-07,國秀樓410教室
SF21,2,2,宋孟遠,綠能職大三, Sport Sociology,通識社會科學領域（運動社會學）,三03-04,國秀樓1樓多媒體視聽室 CoffeeCorner
SF22,3,3,顏阿桃,綠能職大三, Business Ethics,職場倫理,一02-04,E102電子實驗室
SF23,3,4,陳清光,綠能職大三, Refrigeration and Air-Conditioning Energy-Saving Technique and Practices,冷凍空調節能技術及實習,五01-04,國秀樓5樓多媒體暨口譯教室
SF24,0,0,,綠能職大三,,班週會時間,四01-02,E102電子實驗室
SG01,2,2,林怡萱,雙軌職四休一選,,古典音樂鑑賞（二）,三10-11,文化休閒館CR202教室
SG02,2,2,洪群翔,雙軌職四休二選1, Sports training,運動訓練指導法,一05-06,文化休閒館CR204休閒健康促進專業教室
SG03,2,2,陳依蘋,雙軌職四休二選2, Leisure Art Appreciation,休閒藝術賞析,二12-13,文化休閒館CR202教室
SG21,0,2,蘇榮基,雙軌職四休一, Physical Education （Ⅱ）,體育（二）,四03-04,網球場
SG22,2,2,林錦婷,雙軌職四休一, Practical writing（Ⅱ）,應用文（二）,三03-04,文化休閒館CR308教室
SG23,3,9,雙軌職四休一,雙軌職四休一, Service Operations Management for Leisure Industry（II）,服務作業管理與實習（二）,,
SG24,2,2,王靖欣,雙軌職四休一, Introduction to Business,企業概論,三07-08,文化休閒館CR202教室
SG25,2,2,物流管理,雙軌職四休一, Logistics Management,物流管理,四01-02,文化休閒館CR202教室
SG26,2,2,林雲燦,雙軌職四休一, Marketing Management,行銷管理,三05-06,文化休閒館CR202教室
SG27,0,2,林誯鎮,雙軌職四休二, PhysicalEducation（Ⅳ）,體育（四）,一03-04,羽球場
SG28,2,2,羅友志,雙軌職四休二, Basic English（Ⅱ）,基礎英文（二）,二03-04,文化休閒館CR202教室
SG29,2,2,陳卉芬,雙軌職四休二, Mathematics（Ⅱ）,管理數學（二）,一10-11,文化休閒館CR202教室
SG30,3,9,雙軌職四休二,雙軌職四休二, Service Operations Management for Leisure Industry（Ⅳ）,服務作業管理與實習（四）,,
SG31,2,2,陳依蘋,雙軌職四休二,,食品安全衛生與法規,二10-11,文化休閒館CR202教室
SG32,2,2,陳細鈿,雙軌職四休二, Cost Control and Operating Profit Analysis,成本控管與淨利分析,二07-08,文化休閒館CR308教室
SG33,2,2,陳泰衡,雙軌職四休二, Tourism Geography and Food Culture,觀光地理與餐飲文化,二05-06,文化休閒館CR202教室
SG34,0,0,,雙軌職四休一,,班週會時間,三02-02,"文化休閒館CR202教室), 四02-0"
SG35,0,0,,雙軌職四休二,,班週會時間,一02-02,"文化休閒館CR202教室), 二01-0"
SH21,2,2,楊靜芬,智資職大一, Applied chinese （Ⅱ）,應用國文（二）,四10-11,管理館M501
SH22,3,3,張億收,智資職大一, Practical English （Ⅱ）,實用英文（二）,五13-13,"管理館M501), 六11-1"
SH23,3,3,張麗芬,智資職大一, Calculus（Ⅱ）,微積分（二）,五10-12,管理館M501
SH24,0,2,高文揚,智資職大一, PhysicalEducation（Ⅱ）,體育（二）,四12-13,高爾夫球練習場
SH25,3,6,產業實務實習二,智資職大一, The industry practises really and practically（Ⅱ）,產業實務實習（二）,,
SH26,2,4,蔡梨暖,智資職大一, Practice of Machine Tool,數控工具機理論與實習,六02-05,管理館M501
SH27,2,2,白方正,智資職大一, Selection and application of Materials,材料選擇與應用,六09-10,管理館M501
SH28,2,2,林文燦,智資職大一,,職場基本能力（職業倫理）,六07-08,管理館M501
SH29,0,0,,智資職大一,,班週會時間,六01-01,"管理館M501), 六06-0"
T001,0,1,宋孟遠,四機一甲, Labor and Social services Education（Ⅱ）,勞作與社會服務教育（二）,三07-07,國秀樓302教室
T002,0,1,蔡輝炯,四機一丙, Labor and Social services Education（Ⅱ）,勞作與社會服務教育（二）,四08-08,國秀樓301教室
T003,0,1,陳小平,四化一甲, Labor and Social services Education（Ⅱ）,勞作與社會服務教育（二）,三07-07,國秀樓305教室
T004,0,1,吳慧雯,四電一甲, Labor and Social services Education（Ⅱ）,勞作與社會服務教育（二）,四08-08,國秀樓402教室
T005,0,1,伍木成,四電一乙, Labor and Social services Education（Ⅱ）,勞作與社會服務教育（二）,三05-05,國秀樓407教室
T006,0,1,陳建文,四子一甲, Labor and Social services Education（Ⅱ）,勞作與社會服務教育（二）,三07-07,國秀樓313教室
T007,0,1,林志洪,四子一丙, Labor and Social services Education（Ⅱ）,勞作與社會服務教育（二）,五02-02,國秀樓012教室
T008,0,1,黃美玲,四工一乙, Labor and Social services Education（Ⅱ）,勞作與社會服務教育（二）,二08-08,國秀樓311教室
T009,0,1,黃美玲,四工一丙, Labor and Social services Education（Ⅱ）,勞作與社會服務教育（二）,五05-05,國秀樓312教室
T010,0,1,林裕淩,四企一乙, Labor and Social services Education（Ⅱ）,勞作與社會服務教育（二）,二01-01,企管系會議室
T011,0,1,陳志昌,四文一甲, Labor and Social services Education（Ⅱ）,勞作與社會服務教育（二）,三07-07,國秀樓307教室
T012,0,1,謝文健,四冷一甲, Labor and Social services Education（Ⅱ）,勞作與社會服務教育（二）,二08-08,國秀樓401教室
T013,0,1,彭國芳,四技流一乙, Labor and Social services Education（Ⅱ）,勞作與社會服務教育（二）,一08-08,國秀樓401教室
T014,0,1,江欣惇,四訊一甲, Labor and Social services Education（Ⅱ）,勞作與社會服務教育（二）,二08-08,國秀樓407教室
T015,0,1,陳東賢,四訊一丙, Labor and Social services Education（Ⅱ）,勞作與社會服務教育（二）,五05-05,國秀樓403教室
T016,0,1,黃凌瑤,四資一甲, Labor and Social services Education（Ⅱ）,勞作與社會服務教育（二）,二07-07,工具機學院大樓四樓多功能教室
T101,0,1,林佩芬,四企一甲, Labor and Social services Education（Ⅱ）,勞作與社會服務教育（二）,一01-01,
T102,0,1,徐瑋瑩,四子一乙, Labor and Social services Education（Ⅱ）,勞作與社會服務教育（二）,二03-03,
T103,0,1,邱俊智,四機一乙, Labor and Social services Education（Ⅱ）,勞作與社會服務教育（二）,二09-09,
T104,0,1,薛仰禮,四機一丁, Labor and Social services Education（Ⅱ）,勞作與社會服務教育（二）,二02-02,
T105,0,1,黃書祥,四訊一乙, Labor and Social services Education（Ⅱ）,勞作與社會服務教育（二）,五01-01,
T106,0,1,梁隨燕,四資一乙, Labor and Social services Education（Ⅱ）,勞作與社會服務教育（二）,三01-01,
T107,0,1,黃美玲,四工一甲, Labor and Social services Education（Ⅱ）,勞作與社會服務教育（二）,四08-08,
T108,0,1,王偉驎,四工一丁, Labor and Social services Education（Ⅱ）,勞作與社會服務教育（二）,一06-06,
T109,0,1,邱維銘,四化一乙, Labor and Social services Education（Ⅱ）,勞作與社會服務教育（二）,二01-01,
T110,0,1,葉怡巖,四化一丙, Labor and Social services Education（Ⅱ）,勞作與社會服務教育（二）,五08-08,
T111,0,1,王輔仁,四冷一乙, Labor and Social services Education（Ⅱ）,勞作與社會服務教育（二）,四05-05,
T112,0,1,楊愷祥,四冷一丙, Labor and Social services Education（Ⅱ）,勞作與社會服務教育（二）,五08-08,
T113,0,1,姚威宏,四電一丙, Labor and Social services Education（Ⅱ）,勞作與社會服務教育（二）,五08-08,
T114,0,1,洪群翔,四休閒一甲, Labor and Social services Education（Ⅱ）,勞作與社會服務教育（二）,二08-08,
T115,0,1,林佳靜,四英一甲, Labor and Social services Education（Ⅱ）,勞作與社會服務教育（二）,三07-07,
T116,0,1,陳細鈿,四技流一甲, Labor and Social services Education（Ⅱ）,勞作與社會服務教育（二）,一01-01,
T117,0,1,謝翠玲,四景一甲, Labor and Social services Education（Ⅱ）,勞作與社會服務教育（二）,三02-02,
T118,0,1,姚威宏,, Labor and Social services Education（Ⅱ）,勞作與社會服務教育（二）,六02-02,
W001,2,2,謝攸青,四技通識必修," Style, aesthetics, and modern life",通識人文藝術領域（風格、美學與現代生活）,一05-06,國秀樓4F美術鑑賞教室
W002,2,2,劉淑如,四技通識必修, Dialogue of Classical music and Movie,通識人文藝術領域（古典音樂與電影的對話）,一05-06,國秀樓3F音樂欣賞教室
W003,2,2,游惠遠,四技通識必修, Gender Issues and Text Analysis,通識人文藝術領域（性別議題與電影）,一05-06,文化休閒館CRB02
W004,2,2,謝炯庠,四技通識必修, Global Polotical Economy,通識社會科學領域（全球政治經濟）,一05-06,國秀樓012教室
W005,2,2,楊卿,四技通識必修, Psychology and modern life,通識社會科學領域（心理與生活）,一05-06,國秀樓005教室
W006,2,2,楊馥綺,四技通識必修, Positive thinking and well-being,通識社會科學領域（正向思考與幸福人生）,一05-06,國秀樓010教室
W007,2,2,劉柏宏,四技通識必修, Scientific Decoding of Leonardo Davinci,通識自然科學領域（科學解碼達文西）,一05-06,國秀樓011教室
W008,2,2,張漢昌,四技通識必修, Science of toxic materials and environment,通識自然科學領域（生活與毒化物科學）,一05-06,國秀樓503教室
W009,2,2,呂小燕,四技通識必修," Movies,Cultures and Life",通識人文藝術領域（電影、文化與人生）,二07-08,國秀樓005教室
W010,2,2,唐屹軒,四技通識必修, Historiophoty and Historical narrative: Korean history volume,通識人文藝術領域（影像史學與歷史敘事‧韓國篇）,二07-08,國秀樓305教室
W011,2,2,陳廷育,四技通識必修, Occupational Safety and Sanitation,通識社會科學領域（職業安全與衛生）,二07-08,國秀樓509教室
W012,2,2,鄭又腆,四技通識必修, Digital Marketing Planning and Design,通識社會科學領域（數位行銷規劃與設計）,二07-08,管理館M611-1
W013,2,2,王仁祿,四技通識必修, Book of Changes and Life,通識社會科學領域（易經與人生）,二07-08,國秀樓307教室
W014,2,2,謝翠玲,四技通識必修, Sustainability development and Green Technology,通識自然科學領域（綠色科技與永續發展）,二07-08,國秀樓011教室
W015,2,2,許朕諭,四技通識必修, Green life,通識自然科學領域（現代綠生活）,二07-08,國秀樓012教室
W016,2,2,傅光森,四技通識必修, The different space and time travel of folk custom,通識人文藝術領域（異時空民俗之旅）,四01-02,國秀樓305教室
W017,2,2,鄭志敏,四技通識必修, Sing Appreciation,通識人文藝術領域（歌唱的藝術）,四01-02,國秀樓3F音樂欣賞教室
W018,2,2,王偉驎,四技通識必修, Tea art and life,通識人文藝術領域（茶藝與生活）,四01-02,工303整合製造模擬室
W019,2,2,蘇彥蓁,四技通識必修, Understanding yourself,通識人文藝術領域（心靈探索）,四01-02,國秀樓302教室
W020,2,2,林純芬,四技通識必修, Travel Literature,通識人文藝術領域（旅遊文學）,四01-02,國秀樓303教室
W021,2,2,胡志佳,四技通識必修, Documentary in Taiwan,通識人文藝術領域（紀錄片中的台灣）,四01-02,國秀樓506教室
W022,2,2,林誯鎮,四技通識必修, 0f Recreation sport & Therapy,通識社會科學領域（休閒運動療法理論與實務）,四01-02,國秀樓309教室
W023,2,2,趙申,四技通識必修, Global Issues and International Relations,通識社會科學領域（從全球議題談國際關係）,四01-02,國秀樓507教室
W024,2,2,胡清暉,四技通識必修, Sport marketing and Journalism,通識社會科學領域（運動行銷與傳播）,四01-02,國秀樓409教室
W025,2,2,林澤宏,四技通識必修, Career Ethics,通識社會科學領域（職場倫理）,四01-02,國秀樓313教室
W026,2,2,步國財,四技通識必修, Tour Leader & Tour Guide,通識社會科學領域（觀光領隊導遊）,四01-02,國秀樓406教室
W027,2,2,林麗嬌,四技通識必修, environment protection of modern and innovative life,通識社會科學領域（摩登環保新生活）,四01-02,M423專業科目教
W028,2,2,徐瑋瑩,四技通識必修, Mindfulness-Based Stress Reduction,通識社會科學領域（正念減壓與身心轉化）,四01-02,國秀樓502教室
W029,2,2,王俊傑,四技通識必修, Development of Mathematics And Its Applications,通識自然科學領域（數學發展與應用）,四01-02,國秀樓503教室
W030,2,2,蘇智偉,四技通識必修, Animation Art and Technology,通識自然科學領域（動畫藝術與科技）,四01-02,國秀樓4F美術鑑賞教室
W031,2,2,宋文沛,四技通識必修, Protection and Rehabilitation of Earthquake Disaster,通識自然科學領域（震災防護與復建）,四01-02,國秀樓411教室
W032,2,2,謝翠玲,四技通識必修, Introduction to Life Science,通識自然科學領域（生命科學概論）,四01-02,國秀樓511教室
W033,2,2,林芳如,四技通識必修, Introduction to biotechnology,通識自然科學領域（生物科技概論）,四01-02,國秀樓508教室
W034,2,2,王偉驎,四技通識必修, Tea art and life,通識人文藝術領域（茶藝與生活）,四07-08,工103設施規劃實習室
W035,2,2,周婉儒,四技通識必修, Classical Music Appreciation,通識人文藝術領域（古典音樂欣賞）,四07-08,國秀樓B2美術教室
W037,2,2,呂小燕,四技通識必修," Movies,Cultures and Life",通識人文藝術領域（電影、文化與人生）,四07-08,國秀樓005教室
W038,2,2,石秋燕,四技通識必修, Panorama of French culture and European Museum Tour,通識人文藝術領域（法國文化概況與歐洲博物館巡禮）,四07-08,國秀樓306教室
